{
  "id": "whisper-dandere",
  "type": "waifu",
  "name": "Whisper Dandere",
  "archetype": "Dandere",
  "set": "CORE-01",
  "rarity": "common",
  "affection": 10,
  "bonds": { "start": 0, "max": 12 },
  "mood": { "thresholds": { "dere": 6, "extreme": 10 } },
  "tags": ["defense","stealth"],
  "text": "Passive: Cannot be targeted by opponent Support cards while Neutral. Dere: Gain +2 shield counters. Extreme: When you speak (play a Support), draw a card.",
  "effects": [
    {
      "when": "onSummon",
      "do": [ { "type": "prevent", "target": "self", "amount": 999, "note": "Treat as untargetable by opponent Supports while mood=Neutral" } ]
    },
    {
      "when": "onSummon",
      "do": [ { "type": "buff", "target": "self", "amount": 2, "note": "Add 2 shield counters when reaching Dere" } ]
    },
    {
      "when": "activated",
      "do": [ { "type": "draw", "target": "you", "amount": 1, "note": "Only if mood=Extreme and you played a Support this turn" } ]
    }
  ],
  "flavor": "When she finally speaks up, the whole battlefield listens.",
  "art": {
    "default": "cards/waifus/dandere/whisper-dandere-default.png",
    "extreme": "cards/waifus/dandere/whisper-dandere-extreme.png"
  },
  "version": 1
}
