{
  "id": "sunbeam-deredere",
  "type": "waifu",
  "name": "Sunbeam Deredere",
  "archetype": "Deredere",
  "set": "CORE-01",
  "rarity": "rare",
  "affection": 9,
  "bonds": { "start": 2, "max": 14 },
  "mood": { "thresholds": { "dere": 5, "extreme": 11 } },
  "tags": ["support","heal"],
  "text": "Start of Turn: Give bonded allies +1 {BOND}. Activated: Spend 1 {BOND} to heal 2 Affection to another waifu. Extreme: Your bonded allies gain +1 Affection when they attack.",
  "effects": [
    {
      "when": "onSummon",
      "do": [ { "type": "gainBonds", "target": "bondedAllies", "amount": 1, "note": "Resolve at each start of turn" } ]
    },
    {
      "when": "activated",
      "cost": { "bonds": 1 },
      "do": [ { "type": "heal", "target": "choiceAllyWaifu", "amount": 2 } ]
    },
    {
      "when": "onAttack",
      "do": [ { "type": "heal", "target": "bondedAttacker", "amount": 1, "note": "Only if mood=Extreme" } ]
    }
  ],
  "flavor": "A beam of sunshine with emergency snacks for everyone.",
  "art": {
    "default": "cards/waifus/deredere/sunbeam-deredere-default.png",
    "extreme": "cards/waifus/deredere/sunbeam-deredere-extreme.png"
  },
  "version": 1
}
