{
  "id": "example-support-id",
  "type": "support",
  "name": "Example Support",
  "set": "CORE-01",
  "rarity": "rare",
  "cost": 1,
  "tags": [],
  "text": "Choose a waifu: do a helpful thing.",
  "effects": [
    { "when": "activated", "do": [ { "type": "draw", "target": "you", "amount": 1 } ] }
  ],
  "art": { "default": "cards/supports/basic/example-support-id-default.png" },
  "version": 1
}
